{"id":"encounter.machine_silo.patrol_pair","tutorial_hook_ids":"hook.tutorial.first_combat","display_name":"Patrol Pair","review_record_id":"review.encounter.encounter.machine_silo.patrol_pair","loot_item_ids":"item.salvage.scrap_metal","companion_hint_ids":"hint.companion.follow_lane","optional":"false","room_id":"room.raid.patrol_hall","hazard_ids":"hazard.machine_silo.pipe_spark","enemy_units":"enemy.machine_patrol.chaser_01~MeleeChaser~room.raid.patrol_hall","feedback_tag_ids":"tag.feedback.danger,tag.feedback.companion_decision","landmark_ids":"landmark.pipe_arch","pressure_beat_id":"beat.machine_silo.entry_pressure"}
