{"id":"encounter.sky_docks.artifact_watch","tutorial_hook_ids":"hook.tutorial.artifact","display_name":"Artifact Watch","review_record_id":"review.encounter.encounter.sky_docks.artifact_watch","loot_item_ids":"item.quest.artifact_seed","companion_hint_ids":"hint.companion.rare_loot","optional":"false","room_id":"room.sky.artifact_vault","hazard_ids":"hazard.sky_docks.crosswind","enemy_units":"enemy.machine_patrol.chaser_sky_01~MeleeChaser~room.sky.artifact_vault;enemy.machine_patrol.support_sky_01~AlarmSupport~room.sky.artifact_vault","feedback_tag_ids":"tag.feedback.reward,tag.feedback.danger","landmark_ids":"landmark.hanging_crate","pressure_beat_id":"beat.sky_docks.artifact_pressure"}
