{"id":"encounter.machine_silo.vault_watch","tutorial_hook_ids":"hook.tutorial.high_risk","display_name":"Vault Watch","review_record_id":"review.encounter.encounter.machine_silo.vault_watch","loot_item_ids":"item.salvage.power_cell","companion_hint_ids":"hint.companion.loot_ping","optional":"true","room_id":"room.raid.high_risk_vault","hazard_ids":"hazard.machine_silo.vault_arc","enemy_units":"enemy.machine_patrol.chaser_03~MeleeChaser~room.raid.high_risk_vault;enemy.machine_patrol.support_02~AlarmSupport~room.raid.high_risk_vault","feedback_tag_ids":"tag.feedback.reward,tag.feedback.danger","landmark_ids":"landmark.vault_door","pressure_beat_id":"beat.machine_silo.vault_pressure"}
