{"id":"encounter.relay_tunnels.escort_gauntlet","tutorial_hook_ids":"hook.tutorial.revive","display_name":"Escort Gauntlet","review_record_id":"review.encounter.encounter.relay_tunnels.escort_gauntlet","loot_item_ids":"item.salvage.scrap_metal","companion_hint_ids":"hint.companion.guardian","optional":"false","room_id":"room.relay.ambush_fork","hazard_ids":"hazard.relay_tunnels.pulse_gate","enemy_units":"enemy.machine_patrol.chaser_relay_01~MeleeChaser~room.relay.ambush_fork;enemy.machine_patrol.support_relay_01~AlarmSupport~room.relay.ambush_fork","feedback_tag_ids":"tag.feedback.danger,tag.feedback.companion_decision","landmark_ids":"landmark.split_mast","pressure_beat_id":"beat.relay_tunnels.escort_pressure"}
