{"id":"encounter.sky_docks.launch_lane","tutorial_hook_ids":"hook.tutorial.timed_run","display_name":"Launch Lane","review_record_id":"review.encounter.encounter.sky_docks.launch_lane","loot_item_ids":"item.material.nanofiber","companion_hint_ids":"hint.companion.extract","optional":"false","room_id":"room.sky.launch_pad","hazard_ids":"hazard.sky_docks.signal_burst","enemy_units":"enemy.machine_patrol.support_sky_02~AlarmSupport~room.sky.launch_pad","feedback_tag_ids":"tag.feedback.extraction,tag.feedback.danger","landmark_ids":"landmark.runway_beacon","pressure_beat_id":"beat.sky_docks.launch_pressure"}
