{"id":"encounter.machine_silo.guard_post","tutorial_hook_ids":"hook.tutorial.cover","display_name":"Guard Post Hold","review_record_id":"review.encounter.encounter.machine_silo.guard_post","loot_item_ids":"item.salvage.scrap_metal","companion_hint_ids":"hint.companion.defend_player","optional":"false","room_id":"room.raid.guard_post","hazard_ids":"hazard.machine_silo.console_blast","enemy_units":"enemy.machine_patrol.chaser_02~MeleeChaser~room.raid.guard_post;enemy.machine_patrol.support_01~AlarmSupport~room.raid.guard_post","feedback_tag_ids":"tag.feedback.danger,tag.feedback.companion_decision","landmark_ids":"landmark.guard_console","pressure_beat_id":"beat.machine_silo.guard_pressure"}
