{"id":"encounter.relay_tunnels.extraction_rush","tutorial_hook_ids":"hook.tutorial.extract","display_name":"Extraction Rush","review_record_id":"review.encounter.encounter.relay_tunnels.extraction_rush","loot_item_ids":"item.material.nanofiber","companion_hint_ids":"hint.companion.extract","optional":"false","room_id":"room.relay.extraction_lift","hazard_ids":"hazard.relay_tunnels.overload","enemy_units":"enemy.machine_patrol.support_relay_02~AlarmSupport~room.relay.extraction_lift","feedback_tag_ids":"tag.feedback.extraction,tag.feedback.danger","landmark_ids":"landmark.lift_beacon","pressure_beat_id":"beat.relay_tunnels.extract_pressure"}
